{
  "schema_version": "pvec-gold/verification/1",
  "tool": {"name": "step_eval", "evaluator_version": "1", "occt_version": "7.6.3"},
  "numeric_policy_version": "PVec numeric policy v1",
  "units": {"name": "METRE", "canonical": "metre", "scale_to_canonical": {"decimal": "1", "f64_hex": "0x3ff0000000000000"}, "source": "file"},
  "entities": [
    {
      "id": "edge-1",
      "class": "bspline",
      "structure": "CURVE_ONLY",
      "geometry": {"degree": 3, "control_points": [[{"decimal": "1", "f64_hex": "0x3ff0000000000000"}, {"decimal": "1", "f64_hex": "0x3ff0000000000000"}, {"decimal": "0", "f64_hex": "0x0000000000000000"}], [{"decimal": "1", "f64_hex": "0x3ff0000000000000"}, {"decimal": "1", "f64_hex": "0x3ff0000000000000"}, {"decimal": "0", "f64_hex": "0x0000000000000000"}], [{"decimal": "1", "f64_hex": "0x3ff0000000000000"}, {"decimal": "1", "f64_hex": "0x3ff0000000000000"}, {"decimal": "0", "f64_hex": "0x0000000000000000"}], [{"decimal": "1", "f64_hex": "0x3ff0000000000000"}, {"decimal": "1", "f64_hex": "0x3ff0000000000000"}, {"decimal": "0", "f64_hex": "0x0000000000000000"}]], "knots": [{"value": {"decimal": "0", "f64_hex": "0x0000000000000000"}, "multiplicity": 4}, {"value": {"decimal": "1", "f64_hex": "0x3ff0000000000000"}, "multiplicity": 4}]},
      "parameter_domain": {"start": {"decimal": "0", "f64_hex": "0x0000000000000000"}, "end": {"decimal": "1", "f64_hex": "0x3ff0000000000000"}},
      "closure": {"closed_by_endpoint": true, "closed_by_knots": false, "periodic": false},
      "transform": {"convention": "ROW_MAJOR_COLUMN_VECTOR_PARENT_LEFT", "matrix": [{"decimal": "1", "f64_hex": "0x3ff0000000000000"}, {"decimal": "0", "f64_hex": "0x0000000000000000"}, {"decimal": "0", "f64_hex": "0x0000000000000000"}, {"decimal": "0", "f64_hex": "0x0000000000000000"}, {"decimal": "0", "f64_hex": "0x0000000000000000"}, {"decimal": "1", "f64_hex": "0x3ff0000000000000"}, {"decimal": "0", "f64_hex": "0x0000000000000000"}, {"decimal": "0", "f64_hex": "0x0000000000000000"}, {"decimal": "0", "f64_hex": "0x0000000000000000"}, {"decimal": "0", "f64_hex": "0x0000000000000000"}, {"decimal": "1", "f64_hex": "0x3ff0000000000000"}, {"decimal": "0", "f64_hex": "0x0000000000000000"}, {"decimal": "0", "f64_hex": "0x0000000000000000"}, {"decimal": "0", "f64_hex": "0x0000000000000000"}, {"decimal": "0", "f64_hex": "0x0000000000000000"}, {"decimal": "1", "f64_hex": "0x3ff0000000000000"}], "determinant": {"decimal": "1", "f64_hex": "0x3ff0000000000000"}, "classification": "IDENTITY"},
      "samples": [
        {"parameter": {"decimal": "0", "f64_hex": "0x0000000000000000"}, "point": [{"decimal": "1", "f64_hex": "0x3ff0000000000000"}, {"decimal": "1", "f64_hex": "0x3ff0000000000000"}, {"decimal": "0", "f64_hex": "0x0000000000000000"}], "tangent": null, "curvature": null, "derivative_exclusion": "ZERO_SPEED"},
        {"parameter": {"decimal": "0.0625", "f64_hex": "0x3fb0000000000000"}, "point": [{"decimal": "1", "f64_hex": "0x3ff0000000000000"}, {"decimal": "1", "f64_hex": "0x3ff0000000000000"}, {"decimal": "0", "f64_hex": "0x0000000000000000"}], "tangent": null, "curvature": null, "derivative_exclusion": "ZERO_SPEED"},
        {"parameter": {"decimal": "0.125", "f64_hex": "0x3fc0000000000000"}, "point": [{"decimal": "1", "f64_hex": "0x3ff0000000000000"}, {"decimal": "1", "f64_hex": "0x3ff0000000000000"}, {"decimal": "0", "f64_hex": "0x0000000000000000"}], "tangent": null, "curvature": null, "derivative_exclusion": "ZERO_SPEED"},
        {"parameter": {"decimal": "0.1875", "f64_hex": "0x3fc8000000000000"}, "point": [{"decimal": "1", "f64_hex": "0x3ff0000000000000"}, {"decimal": "1", "f64_hex": "0x3ff0000000000000"}, {"decimal": "0", "f64_hex": "0x0000000000000000"}], "tangent": null, "curvature": null, "derivative_exclusion": "ZERO_SPEED"},
        {"parameter": {"decimal": "0.25", "f64_hex": "0x3fd0000000000000"}, "point": [{"decimal": "1", "f64_hex": "0x3ff0000000000000"}, {"decimal": "1", "f64_hex": "0x3ff0000000000000"}, {"decimal": "0", "f64_hex": "0x0000000000000000"}], "tangent": null, "curvature": null, "derivative_exclusion": "ZERO_SPEED"},
        {"parameter": {"decimal": "0.3125", "f64_hex": "0x3fd4000000000000"}, "point": [{"decimal": "1", "f64_hex": "0x3ff0000000000000"}, {"decimal": "1", "f64_hex": "0x3ff0000000000000"}, {"decimal": "0", "f64_hex": "0x0000000000000000"}], "tangent": null, "curvature": null, "derivative_exclusion": "ZERO_SPEED"},
        {"parameter": {"decimal": "0.375", "f64_hex": "0x3fd8000000000000"}, "point": [{"decimal": "1", "f64_hex": "0x3ff0000000000000"}, {"decimal": "1", "f64_hex": "0x3ff0000000000000"}, {"decimal": "0", "f64_hex": "0x0000000000000000"}], "tangent": null, "curvature": null, "derivative_exclusion": "ZERO_SPEED"},
        {"parameter": {"decimal": "0.4375", "f64_hex": "0x3fdc000000000000"}, "point": [{"decimal": "1", "f64_hex": "0x3ff0000000000000"}, {"decimal": "1", "f64_hex": "0x3ff0000000000000"}, {"decimal": "0", "f64_hex": "0x0000000000000000"}], "tangent": null, "curvature": null, "derivative_exclusion": "ZERO_SPEED"},
        {"parameter": {"decimal": "0.5", "f64_hex": "0x3fe0000000000000"}, "point": [{"decimal": "1", "f64_hex": "0x3ff0000000000000"}, {"decimal": "1", "f64_hex": "0x3ff0000000000000"}, {"decimal": "0", "f64_hex": "0x0000000000000000"}], "tangent": null, "curvature": null, "derivative_exclusion": "ZERO_SPEED"},
        {"parameter": {"decimal": "0.5625", "f64_hex": "0x3fe2000000000000"}, "point": [{"decimal": "1", "f64_hex": "0x3ff0000000000000"}, {"decimal": "1", "f64_hex": "0x3ff0000000000000"}, {"decimal": "0", "f64_hex": "0x0000000000000000"}], "tangent": null, "curvature": null, "derivative_exclusion": "ZERO_SPEED"},
        {"parameter": {"decimal": "0.625", "f64_hex": "0x3fe4000000000000"}, "point": [{"decimal": "1", "f64_hex": "0x3ff0000000000000"}, {"decimal": "1", "f64_hex": "0x3ff0000000000000"}, {"decimal": "0", "f64_hex": "0x0000000000000000"}], "tangent": null, "curvature": null, "derivative_exclusion": "ZERO_SPEED"},
        {"parameter": {"decimal": "0.6875", "f64_hex": "0x3fe6000000000000"}, "point": [{"decimal": "1", "f64_hex": "0x3ff0000000000000"}, {"decimal": "1", "f64_hex": "0x3ff0000000000000"}, {"decimal": "0", "f64_hex": "0x0000000000000000"}], "tangent": null, "curvature": null, "derivative_exclusion": "ZERO_SPEED"},
        {"parameter": {"decimal": "0.75", "f64_hex": "0x3fe8000000000000"}, "point": [{"decimal": "1", "f64_hex": "0x3ff0000000000000"}, {"decimal": "1", "f64_hex": "0x3ff0000000000000"}, {"decimal": "0", "f64_hex": "0x0000000000000000"}], "tangent": null, "curvature": null, "derivative_exclusion": "ZERO_SPEED"},
        {"parameter": {"decimal": "0.8125", "f64_hex": "0x3fea000000000000"}, "point": [{"decimal": "1", "f64_hex": "0x3ff0000000000000"}, {"decimal": "1", "f64_hex": "0x3ff0000000000000"}, {"decimal": "0", "f64_hex": "0x0000000000000000"}], "tangent": null, "curvature": null, "derivative_exclusion": "ZERO_SPEED"},
        {"parameter": {"decimal": "0.875", "f64_hex": "0x3fec000000000000"}, "point": [{"decimal": "1", "f64_hex": "0x3ff0000000000000"}, {"decimal": "1", "f64_hex": "0x3ff0000000000000"}, {"decimal": "0", "f64_hex": "0x0000000000000000"}], "tangent": null, "curvature": null, "derivative_exclusion": "ZERO_SPEED"},
        {"parameter": {"decimal": "0.9375", "f64_hex": "0x3fee000000000000"}, "point": [{"decimal": "1", "f64_hex": "0x3ff0000000000000"}, {"decimal": "1", "f64_hex": "0x3ff0000000000000"}, {"decimal": "0", "f64_hex": "0x0000000000000000"}], "tangent": null, "curvature": null, "derivative_exclusion": "ZERO_SPEED"},
        {"parameter": {"decimal": "1", "f64_hex": "0x3ff0000000000000"}, "point": [{"decimal": "1", "f64_hex": "0x3ff0000000000000"}, {"decimal": "1", "f64_hex": "0x3ff0000000000000"}, {"decimal": "0", "f64_hex": "0x0000000000000000"}], "tangent": null, "curvature": null, "derivative_exclusion": "ZERO_SPEED"}
      ]
    }
  ]
}
